question,answer
đào tạo vừa học vừa làm là các hoạt động giảng dạy được thực hiện tại đâu,"Hoạt động đào tạo và giảng dạy tại trường bao gồm: đào tạo trực tuyến (e-Learning – NLU) trên nền tảng Edmodo (gồm cổng đào tạo trực tuyến, hệ thống quản lý học tập, học liệu điện tử, phương thức tương tác, hệ thống kiểm tra, đánh giá); công nhận học phần tích lũy từ các cơ sở đào tạo khác (tuân thủ nguyên tắc nghiêm túc, khách quan, công bằng, phù hợp chuẩn đầu ra, tối đa 50% tổng chương trình); và cho phép sinh viên đăng ký học lại học phần điểm F, cải thiện điểm hoặc học thêm học phần ngoài chương trình đào tạo để lấy chứng nhận."
điều 7 trong quy chế học vụ là gì,Không có thông tin
sửa đổi nào về liên kết đào tạo chỉ thực hiện đối với hình thức vừa làm và học theo quy định của luật giáo dục đại học,Không có thông tin
liên kết đào tạo chỉ thực hiện đối với hình thức nào,Không có thông tin
sửa đổi nào về liên kết đào tạo chỉ thực hiện đối với hình thức vừa học theo quy định của luật giáo dục đại học?,Không có thông tin
sửa đổi nào về liên kết đào tạo chỉ thực hiện đối với các hình thức vừa làm và học theo quy định của luật giáo dục đại học?,Không có thông tin
những yêu cầu tối thiểu để trở thành một nhà liên kết đào tạo đã được công nhận đạt chuẩn chất lượng của khoa / ngành / chuyên ngành cơ hữu giảng dạy là gì,Không có thông tin
những yêu cầu tối thiểu để trở thành một chuyên ngành liên kết đào tạo là gì,Không có thông tin
Các yêu cầu tối thiểu với khoa / ngành / chuyên ngành liên kết đào tạo là gì,Không có thông tin
những yêu cầu tối thiểu để trở thành một nhà liên kết đào tạo đã được công nhận đạt chuẩn chất lượng của khoa / ngành / chuyên ngành là gì,Không có thông tin
những yêu cầu tối thiểu để trở thành một chuyên ngành liên kết đào tạo đã được công nhận đạt chuẩn chất lượng là gì,Không có thông tin
yêu cầu tối thiểu để trở thành một cơ sở phối hợp đào tạo là gì,Không có thông tin
yêu cầu tối thiểu của cơ sở phối hợp đào tạo là gì,Không có thông tin
những yêu cầu tối thiểu để trở thành một cơ sở phối hợp đào tạo là gì,Không có thông tin
yêu cầu của cơ sở phối hợp đào tạo là gì,Không có thông tin
các yêu cầu tối thiểu của cơ sở phối hợp đào tạo là gì,Không có thông tin
trách nhiệm của cơ sở phối hợp đào tạo là gì,Không có thông tin
cơ sở phối hợp đào tạo chịu trách nhiệm gì,Không có thông tin
trách nhiệm của các bên tham gia liên kết đào tạo là gì,Không có thông tin
các trách nhiệm của cơ sở phối hợp đào tạo là gì,Không có thông tin
những trách nhiệm của cơ sở phối hợp đào tạo là gì,Không có thông tin
kế hoạch giảng dạy và học tập là gì,"Điều 9: Tổ chức đăng ký học tập bao gồm các nội dung: sinh viên (có nguyện vọng học, có lý do chính đáng, có quyền yêu cầu phúc khảo bài thi, bị cấm thi, đăng ký lớp học phần mới/chưa đạt/đã đạt/lớp học, thực hiện học lại/cải thiện điểm, không đi học/dự thi, nhận điểm F); khoa (tổ chức kỳ thi kết thúc học phần, cung cấp CTĐT ngành/chuyên ngành, quy định về công tác học vụ, bố trí CVHT, quản lý môn học, cung cấp cho sinh viên, tổ chức theo lịch chung); CVHT (quản lý sinh viên, tư vấn xây dựng/thực hiện KHHT); KHHT (phải tuân theo quy định của trường); phòng đào tạo (công bố danh sách các lớp học phần đủ điều kiện tổ chức giảng dạy, thông báo học phần/TKB cho sinh viên trước học kỳ ít nhất 06 tuần, công bố trước bắt đầu học kỳ ít nhất 01 tuần); học phần (có điểm F, nhận điểm R, phải theo KHHT đã được phê duyệt, đã rút trong rút bớt học phần, lấy điểm cao nhất); TKB (của học phần); danh sách các lớp học phần đủ điều kiện tổ chức giảng dạy (dựa trên sĩ số lớp học phần); KHHT đã được phê duyệt (tham chiếu tới khoản 5 điều 8); số lượng tín chỉ (không dưới 14 tín chỉ, áp dụng sau rút học phần cho học kỳ chính); học kỳ chính (có tối thiểu 14 tín chỉ, tối đa 28 tín chỉ); học kỳ phụ (có tối đa 12 tín chỉ); sinh viên mới trúng tuyển (không đăng ký học phần cho học kỳ đầu tiên); lịch học (theo CTĐT ngành/chuyên ngành); quy trình đăng ký học phần (bao gồm bước 1, 2, 3, 4); bước 1 (thực hiện bởi phòng đào tạo); bước 2 (thực hiện bởi khoa/bộ môn); bước 3 (thực hiện bởi sinh viên); bước 4 (công bố kết quả bởi phòng đào tạo, xem kết quả bởi sinh viên); khoa/bộ môn (dựa trên nhu cầu của sinh viên, muốn duy trì các lớp học phần không đủ số lượng sinh viên); rút bớt học phần (áp dụng cho học kỳ chính/phụ, thực hiện tại website đăng ký học phần, có hạn chót là tuần lễ thứ 2/4); điểm R (ghi nhận trong bảng điểm học kỳ); đăng ký học lại (cho học phần); đăng ký học cải thiện điểm (cho học phần đã đạt); học phần không thuộc CTĐT (không tính vào điểm trung bình học kỳ, không dùng để xét tốt nghiệp).  Điều 10: Tổ chức lớp học phần bao gồm các nội dung: sinh viên (có nguyện vọng học, có lý do chính đáng, có quyền yêu cầu phúc khảo bài thi, bị cấm thi, đăng ký lớp học phần mới/chưa đạt/đã đạt/lớp học, thực hiện học lại/cải thiện điểm, không đi học/dự thi, nhận điểm F); hiệu trưởng (quyết định các trường hợp khác, phê duyệt văn bản đề nghị, căn cứ vào quy chế đào tạo, quyết định thời hạn đình chỉ học tập có thời hạn); khoa/bộ môn (dựa trên nhu cầu của sinh viên, muốn duy trì các lớp học phần không đủ số lượng sinh viên); điểm F (ghi vào bảng điểm); lớp học phần (dựa vào số lượng đăng ký của sinh viên, áp dụng cho học phần lý thuyết/lý thuyết kết hợp thực hành/thực hành/thực tập/đồ án/giáo dục thể chất, tổ chức theo học phần/trong học kỳ); số lượng đăng ký của sinh viên (ít hơn 30/20/40); số lượng sinh viên tối thiểu (áp dụng cho học phần lý thuyết/lý thuyết kết hợp thực hành/thực hành/thực tập/đồ án/giáo dục thể chất, có giá trị là 30/20/40); số lượng sinh viên tối đa (áp dụng cho học phần lý thuyết/lý thuyết kết hợp thực hành/thực hành/thực tập/đồ án/giáo dục thể chất, có giá trị là 60/200/50); số lượng sinh viên chuẩn (áp dụng cho học phần lý thuyết/lý thuyết kết hợp thực hành/thực hành/thực tập/đồ án, có giá trị là 60/25); trưởng khoa (đề xuất các trường hợp khác); hủy lớp học phần (áp dụng cho lớp lý thuyết, lý thuyết kết hợp thực hành/thực hành, thực tập, đồ án/học phần giáo dục thể chất); lớp lý thuyết, lý thuyết kết hợp thực hành (có số lượng đăng ký của sinh viên); lớp thực hành, thực tập, đồ án (có số lượng đăng ký của sinh viên); lớp học phần giáo dục thể chất (có số lượng đăng ký của sinh viên); duy trì các lớp học phần không đủ số lượng sinh viên (yêu cầu văn bản đề nghị); văn bản đề nghị (có cam kết giải pháp tài chính, phải được phê duyệt trước bắt đầu học kỳ, chậm nhất là 01 tuần); giải pháp tài chính (đảm bảo bằng tổng học phí lớp/kinh phí của lớp với số lượng sinh viên tối thiểu); học phí của 01 sinh viên (tính cho lớp lý thuyết, lý thuyết kết hợp thực hành/thực hành, thực tập, đồ án); mở thêm lớp học phần (thực hiện trong thời gian xây dựng kế hoạch giảng dạy, dựa trên nguyện vọng của sinh viên, yêu cầu từ 30, được đề xuất bởi khoa/bộ môn, được chấp thuận bởi hiệu trưởng); tiết 1, 2, 3, 4, 5, 6, 7, 8, 9, 10, 11, 12, 13, 14, 15 (diễn ra vào các thời gian tương ứng); cán bộ giảng dạy (thông báo đề cương chi tiết học phần, đề xuất danh sách sinh viên bị cấm thi, thông báo cho sinh viên vào buổi học đầu tiên); đề cương chi tiết học phần (bao gồm nội dung học phần, tài liệu tham khảo, phương pháp giảng dạy, hình thức kiểm tra đánh giá, cách tính điểm); dự thi đánh giá học phần (yêu cầu tham dự tối thiểu 80%/đầy đủ 100% số giờ); 80% số giờ (áp dụng cho học phần lý thuyết); 100% số giờ (áp dụng cho học phần thực hành, thí nghiệm, thực tập ngoài trường, lý thuyết kết hợp thực hành); cấm thi (do vắng lên lớp nhiều hơn thời gian quy định)."
định nghĩa kế hoạch giảng dạy và học tập,Không có thông tin
điều 8 trong quy chế học vụ là gì,Không có thông tin
kế hoạch giảng dạy và học tập là gì,Không có thông tin
kế hoạch giảng dạy và học tập được sử dụng để làm gì,Không có thông tin
kế hoạch năm học là gì,Không có thông tin
mốc thời gian của các hoạt động đào tạo được công bố kịp thời tới các bên liên quan trước khi bắt đầu năm học là gì,Trường công bố thông tin những học phần sẽ được giảng dạy trong học kỳ tiếp theo và thời khóa biểu (TKB) của từng học phần trước mỗi học kỳ ít nhất 06 tuần; danh sách các lớp học phần đủ điều kiện tổ chức giảng dạy sẽ được công bố ít nhất 01 tuần trước khi bắt đầu học kỳ.  Cán bộ giảng dạy thông báo đề cương chi tiết học phần cho sinh viên vào buổi học đầu tiên.  Trưởng Khoa/Bộ môn thông báo công khai danh sách sinh viên bị cấm thi trước khi thi ít nhất 01 tuần.
mốc thời gian của các hoạt động đào tạo trong năm học là gì,Thời gian học được quy định cụ thể trong thời khóa biểu.  Thông báo về các học phần sẽ được giảng dạy trong học kỳ tiếp theo được thực hiện trước mỗi học kỳ ít nhất 6 tuần. Danh sách các lớp học phần đủ điều kiện tổ chức giảng dạy được công bố ít nhất 1 tuần trước khi bắt đầu học kỳ.  Đề cương chi tiết học phần được thông báo vào buổi học đầu tiên. Danh sách sinh viên bị cấm thi được thông báo trước khi thi ít nhất 1 tuần.
kế hoạch năm học thể hiện những gì,"Dựa trên tài liệu cung cấp, kế hoạch năm học thể hiện việc sinh viên phải đăng ký học phần theo kế hoạch chung của trường trước mỗi học kỳ, bao gồm các học phần mới, học phần chưa đạt và học phần muốn cải thiện điểm (Trách nhiệm của sinh viên và Trách nhiệm đăng ký học phần của sinh viên).  Kế hoạch năm học cũng liên quan đến tiêu chuẩn và số lượng sinh viên tiêu biểu được chọn dựa trên kết quả học tập, rèn luyện và hoạt động Đoàn-Hội (Tiêu chuẩn và số lượng sinh viên tiêu biểu). Cuối cùng, kế hoạch năm học còn đề cập đến việc trường xem xét công nhận và chuyển đổi tín chỉ từ các chương trình đào tạo khác (Công nhận và chuyển đổi tín chỉ)."
mốc thời gian của các hoạt động đào tạo trong năm học cho tất cả các hình thức được công bố kịp thời tới các bên liên quan trước khi bắt đầu là gì?,Không có thông tin
bao nhiêu tuần lên lớp trong một năm học,Không có thông tin
có bao nhiêu học kỳ trong một năm học,Không có thông tin
có bao nhiêu tuần lên lớp trong một năm học,Không có thông tin
một năm học có bao nhiêu tuần lên lớp,Không có thông tin
có bao nhiêu học kỳ phụ trong một năm,Không có thông tin
có bắt buộc sinh viên phải học học kỳ phụ không,Không có thông tin
làm thế nào để bắt buộc sinh viên phải học kỳ phụ,Không có thông tin
điều gì sẽ xảy ra nếu một sinh viên bắt buộc học kỳ phụ,Không có thông tin
không bắt buộc sinh viên phải học học kỳ phụ đúng không,Không có thông tin
có bắt buộc sinh viên phải học học kỳ phụ không,Không có thông tin
sinh viên năm thứ nhất không đăng ký học kỳ phụ đúng không,"Tài liệu đề cập đến việc sinh viên đăng ký học phần (điều 9: tổ chức đăng ký học tập),  bao gồm cả việc đăng ký học kỳ chính và học kỳ phụ (học kỳ chính có tối thiểu 14 tín chỉ, học kỳ phụ có tối đa 12 tín chỉ), nhưng không cung cấp thông tin cụ thể về việc sinh viên *có* hay *không* được đăng ký học kỳ phụ.  Không có thông tin."
sinh viên năm thứ nhất có đăng ký học kỳ phụ không,Không có thông tin.
sinh viên năm thứ nhất không đăng ký học kỳ phụ,Không có thông tin.
những gì được coi là một sinh viên năm thứ nhất không đăng ký học kỳ phụ,Không có thông tin.
sinh viên năm thứ nhất có thể đăng ký học kỳ phụ không,"Dựa trên tài liệu, việc sinh viên có thể rút học phần ở học kỳ phụ (điểm a, phần ""Sinh viên có thể rút bớt học phần đã đăng ký"") ngụ ý rằng học kỳ phụ tồn tại và sinh viên có thể đăng ký. Tuy nhiên, tài liệu không nói rõ sinh viên năm nhất có được phép hay không. Không có thông tin."
kế hoạch học kỳ là gì,"Theo tài liệu, kế hoạch học kỳ bao gồm việc sinh viên đăng ký tham dự các lớp học phần dự định học trong học kỳ đó (bao gồm học phần mới, học phần chưa đạt để học lại và học phần đã đạt để cải thiện điểm), và các học phần này phải theo Kế hoạch Học tập cá nhân (KHHT) đã được phê duyệt.  Sinh viên phải đăng ký theo kế hoạch chung của trường trước khi học kỳ mới bắt đầu."
kế hoạch học kỳ bao gồm những gì,"Kế hoạch học kỳ bao gồm việc sinh viên đăng ký học phần theo kế hoạch chung của trường trước khi học kỳ mới bắt đầu;  các học phần đăng ký phải theo KHHT đã được phê duyệt;  việc đăng ký bao gồm học phần mới, học phần chưa đạt (để học lại), và học phần đã đạt (để cải thiện điểm)."
những gì được bao gồm trong kế hoạch học kỳ,"Kế hoạch học kỳ bao gồm việc sinh viên đăng ký học phần theo kế hoạch chung của trường trước khi học kỳ mới bắt đầu. Các học phần đăng ký phải theo KHHT đã được phê duyệt. Việc đăng ký bao gồm: học phần mới, học phần chưa đạt (để học lại), và học phần đã đạt (để cải thiện điểm)."
những gì được bao gồm trong một kế hoạch học kỳ,"Dựa trên các tài liệu được cung cấp, kế hoạch học kỳ bao gồm việc sinh viên đăng ký học phần theo kế hoạch chung của trường trước mỗi học kỳ. Việc đăng ký này bao gồm các học phần mới, học phần chưa đạt (để học lại, nếu có) và học phần đã đạt (để cải thiện điểm, nếu có).  Ngoài ra, kế hoạch học kỳ còn đề cập đến quy định về thời gian và điều kiện nghỉ học tạm thời (tối đa 2 học kỳ liên tiếp, tổng thời gian không quá ½ thời gian đào tạo, phải hoàn thành nghĩa vụ học phí và được bảo lưu kết quả học tập) và quy định kỳ thi kết thúc học phần (được tổ chức một lần và sinh viên phải tuân thủ các quy định của trường)."
mục đích của kế hoạch học kỳ là gì,Không có thông tin
"một kế hoạch học kỳ phải được xây dựng và công bố kịp thời với đầy đủ thông tin cần thiết, bảo đảm thuận tiện cho sinh viên và đăng ký học tập là gì?","Dựa trên tài liệu, kế hoạch học kỳ được xây dựng và công bố thông qua quy trình sau: Phòng Đào tạo công bố danh sách học phần và số lớp dự kiến mở (Bước 1). Khoa đề xuất điều chỉnh (Bước 2). Sinh viên đăng ký trực tuyến dựa trên kế hoạch chung (Bước 3).  Phòng Đào tạo công bố kết quả đăng ký và sinh viên xem, in thời khóa biểu (Bước 4).  Tài liệu không cung cấp thông tin chi tiết về việc kế hoạch học kỳ phải được xây dựng và công bố kịp thời với đầy đủ thông tin cần thiết để bảo đảm thuận tiện cho sinh viên đăng ký học tập."
"một kế hoạch học kỳ phải được xây dựng và công bố kịp thời với đầy đủ thông tin cần thiết, bảo đảm thuận tiện cho sinh viên và đăng ký học tập là gì","Kế hoạch học kỳ được xây dựng và công bố kịp thời bởi Phòng Đào tạo (Bước 1, Quy trình đăng ký học phần).  Kế hoạch này bao gồm thông tin về các học phần, số lớp học phần dự định mở trong học kỳ tiếp theo (Bước 1, Quy trình đăng ký học phần).  Khoa có thể đề xuất điều chỉnh kế hoạch này, bao gồm hủy hoặc mở thêm học phần, điều chỉnh số lớp học phần (Bước 2, Quy trình đăng ký học phần).  Sau khi Phòng Đào tạo công bố kết quả điều chỉnh, sinh viên sử dụng kế hoạch học tập (KHHT) và thời khóa biểu (TKB) để đăng ký trực tuyến (Bước 3, Quy trình đăng ký học phần) và xem, in thời khóa biểu (Bước 4, Quy trình đăng ký học phần).  Việc công bố kịp thời và đầy đủ thông tin trong kế hoạch học kỳ nhằm bảo đảm thuận tiện cho sinh viên đăng ký học tập."
kế hoạch học kỳ phải phải như thế nào,"Kế hoạch học kỳ bao gồm các học phần được đăng ký theo kế hoạch chung của trường và kế hoạch học tập (KHHT) đã được phê duyệt (Trách nhiệm của sinh viên).  Sinh viên đăng ký học phần trước mỗi học kỳ, bao gồm học phần mới, học phần chưa đạt (để học lại) và học phần đã đạt (để cải thiện điểm) (Trách nhiệm đăng ký học phần của sinh viên).  Phòng Đào tạo thông báo cho sinh viên những học phần sẽ được giảng dạy trong học kỳ tiếp theo và thời khóa biểu (TKB) ít nhất 6 tuần trước khi bắt đầu học kỳ (Trách nhiệm của trường trong đào tạo).  Kế hoạch này được xây dựng trên cơ sở khung chương trình đào tạo (CTĐT) và nhu cầu của sinh viên (Trách nhiệm của trường trong đào tạo)."
"một kế hoạch học kỳ phải được xây dựng và công bố kịp thời với đầy đủ thông tin cần thiết, bảo đảm thuận tiện cho sinh viên đăng ký học tập của học viên như thế nào?","Kế hoạch học kỳ được xây dựng và công bố kịp thời bởi Phòng Đào tạo (Bước 1, Quy trình đăng ký học phần). Kế hoạch này gồm thông tin về các học phần và số lớp học phần dự kiến mở trong học kỳ tiếp theo (Bước 1, Quy trình đăng ký học phần). Khoa đề xuất điều chỉnh kế hoạch, bao gồm hủy hoặc mở thêm học phần (Bước 2, Quy trình đăng ký học phần). Sau khi Phòng Đào tạo công bố kết quả điều chỉnh, sinh viên/học viên đăng ký trực tuyến dựa trên KHHT và TKB (Bước 3, Quy trình đăng ký học phần) và xem, in thời khóa biểu (Bước 4, Quy trình đăng ký học phần). Việc công bố kịp thời và đầy đủ thông tin giúp sinh viên/học viên đăng ký thuận tiện."
"một kế hoạch học kỳ phải được xây dựng và công bố kịp thời với đầy đủ thông tin cần thiết, bảo đảm thuận tiện cho sinh viên và đăng ký học tập của học viên là gì","Kế hoạch học kỳ được Phòng Đào tạo xây dựng và công bố kịp thời (Bước 1, Quy trình đăng ký học phần). Kế hoạch bao gồm thông tin về các học phần và số lớp dự kiến mở (Bước 1). Khoa có thể đề xuất hủy hoặc thêm học phần, điều chỉnh số lớp (Bước 2). Sinh viên đăng ký trực tuyến dựa trên kế hoạch học tập (KHHT) và thời khóa biểu (TKB) do Phòng Đào tạo công bố (Bước 3). Sau khi công bố kết quả, sinh viên xem và in thời khóa biểu (Bước 4).  Thông tin đầy đủ và công bố kịp thời giúp sinh viên đăng ký thuận tiện."
"thời khoá biểu là gì và nó được sử dụng như thế nào trong việc tạo ra các hoạt động dạy và học của từng lớp thuộc các khoá học, hình thức và địa điểm diễn ra ở đâu và tại sao nó lại quan trọng đối với tất cả các vấn đề về mặt giáo dục và thực hiện những điều kiện nào để xác định sự khác biệt giữa các khóa học và kỹ thuật y tế và cơ sở điều dưỡng và dựa trên định nghĩa ctdt và chức năng tổng hợp?",Không có thông tin
"tkb là gì và nó được sử dụng như thế nào trong việc tạo ra các hoạt động dạy và học của từng lớp thuộc các khoá học, hình thức và địa điểm diễn ra ở đâu và tại sao nó lại quan trọng đối với tất cả các vấn đề về mặt giáo dục và thực hiện những điều kiện nào để xác định sự khác biệt giữa các khóa học và kỹ thuật y tế và cơ sở điều dưỡng và dựa trên định nghĩa ctdt và chức năng tập thể hiện thời gian trong trường học?",Không có thông tin
thời khoá biểu thể hiện những gì,"Thời khóa biểu thể hiện thời gian cụ thể của các tiết học (ví dụ: Tiết 1: 07g00 - 07g50, Tiết 2: 07g50 - 08g40, v.v...).  Sinh viên phải tham dự đủ số buổi học theo quy định (80% đối với lý thuyết, 100% đối với thực hành) để được dự thi."
tkb thể hiện những gì,"Thời khóa biểu (TKB) thể hiện thông tin về lịch học, bao gồm các lớp học phần, thời gian học, số lượng tín chỉ, và các thông tin liên quan đến việc đăng ký học phần của sinh viên.  TKB được phòng đào tạo thông báo cho sinh viên trước ít nhất 6 tuần hoặc 1 tuần trước khi bắt đầu học kỳ. Sinh viên có thể xem và in thời khóa biểu tại website đăng ký học phần."
"thời khoá biểu là gì và nó được sử dụng như thế nào trong việc tạo ra các hoạt động dạy và học của từng lớp thuộc các khoá học, hình thức và địa điểm diễn ra ở đâu và tại sao nó lại quan trọng đối với tất cả các vấn đề về mặt giáo dục và thực hiện những điều kiện nào để xác định sự khác biệt giữa các khóa học và kỹ thuật y tế và cơ sở điều dưỡng và dựa trên các định nghĩa ctdt và chức năng tổng hợp?",Không có thông tin
thời khóa biểu của các lớp học phần bình thường được bố trí đều trong các tuần,Không có thông tin
thời khóa biểu của các lớp học phần bình thường là gì,"Thời khóa biểu lớp học bình thường thể hiện thời gian cụ thể của các tiết học, ví dụ: Tiết 1: 07g00 - 07g50; Tiết 2: 07g50 - 08g40;...và các tiết học khác.  Sinh viên phải tham dự đủ số buổi học theo quy định (80% đối với lý thuyết, 100% đối với thực hành) mới được dự thi."
thời khóa biểu cho các lớp học phần bình thường được bố trí đều trong các tuần của học kỳ,Không có thông tin
