question,answer
quy trình tiến hành đánh giá kết quả khóa luận theo chương trình quy định,"Quy trình đánh giá kết quả khóa luận:
Bước 1: Sinh viên nộp 03 cuốn báo cáo có xác nhận của giáo viên hướng dẫn (sinh viên chỉ được báo cáo khi được sự đồng ý của giảng viên hướng dẫn).
Bước 2: Trưởng khoa đề xuất danh sách hội đồng và lập sinh viên được đánh giá kết quả khóa luận, Hiệu trưởng ra quyết định. Hội đồng gồm 03 thành viên (người có chuyên môn đúng hoặc gần với đề tài nghiên cứu): chủ tịch, ủy viên phản biện, ủy viên;  trong đó có 01 thành viên công tác ngoài trường. Giảng viên hướng dẫn không tham gia. Hội đồng có thể có thư ký hành chính (chuẩn bị hồ sơ, ghi biên bản, không đánh giá).
Bước 3: Tiến hành đánh giá: Sinh viên trình bày tóm tắt kết quả (không quá 15 phút), các thành viên góp ý, đặt câu hỏi, sinh viên trả lời, thư ký đọc phiếu nhận xét của giảng viên hướng dẫn, các thành viên chấm điểm độc lập theo tiêu chí đã công bố. Điểm là trung bình cộng điểm của ba thành viên hội đồng và giảng viên hướng dẫn.  Nếu điểm chênh lệch nhau trên 3 điểm, chủ tịch hội đồng thảo luận để quyết định (quyết định cuối cùng).
Sinh viên thảo luận với giảng viên hướng dẫn, giải trình và chỉnh sửa theo góp ý của hội đồng trước khi nộp lưu.  Sinh viên được gia hạn thời gian (không quá 2 lần, trường hợp đặc biệt do Trưởng khoa quyết định) và phải đóng lại học phí khi gia hạn.  Sinh viên không hoàn thành hoặc nhận điểm F có thể làm lại đề tài khác hoặc chọn thực hiện tiểu luận và học bổ sung tín chỉ."
quy trình tiến hành đánh giá kết quả khóa luận theo chương trình quy định gồm,"Bước 1: Sinh viên nộp 03 (ba) cuốn báo cáo có xác nhận của giáo viên hướng dẫn. Sinh viên chỉ được báo cáo kết quả đề tài khóa luận khi được sự đồng ý của giảng viên hướng dẫn.
Bước 2: Trưởng khoa đề xuất danh sách hội đồng và lập sinh viên được đánh giá kết quả khóa luận, Hiệu trưởng ra quyết định. Hội đồng đánh giá kết quả khóa luận có 03 thành viên, là những người có chuyên môn đúng hoặc gần với đề tài nghiên cứu, gồm: chủ tịch hội đồng, ủy viên phản biện, ủy viên; trong đó có 01 (một) thành viên công tác ngoài trường. Giảng viên hướng dẫn không tham gia hội đồng đánh giá kết quả đề tài khóa luận của sinh viên do mình hướng dẫn. Hội đồng có thể có thư ký hành chính (chuẩn bị hồ sơ, ghi biên bản, không đánh giá).
Bước 3: Tiến hành đánh giá kết quả khóa luận theo chương trình quy định:
+ Sinh viên trình bày tóm tắt kết quả trong thời gian không quá 15 phút.
+ Các thành viên hội đồng góp ý, đặt câu hỏi.
+ Sinh viên trả lời câu hỏi trực tiếp.
+ Thư ký đọc phiếu nhận xét của giảng viên hướng dẫn về tinh thần, thái độ, tác phong làm việc, kết quả nghiên cứu và kiến thức của sinh viên.
+ Các thành viên hội đồng chấm điểm độc lập theo các tiêu chí đã được công bố. Việc đánh giá kết quả đề tài khóa luận phải đảm bảo minh bạch, công bằng, đánh giá được quá trình thực hiện đề tài của sinh viên.
+ Điểm kết quả khóa luận của sinh viên là trung bình cộng điểm của ba thành viên hội đồng và giảng viên hướng dẫn. Trường hợp các điểm thành phần chênh lệch nhau trên 3 điểm, chủ tịch hội đồng cần tổ chức thảo luận để quyết định. Kết luận của chủ tịch hội đồng là quyết định cuối cùng.
Sinh viên có trách nhiệm thảo luận với giảng viên hướng dẫn, giải trình và chỉnh sửa theo góp ý của hội đồng đánh giá trước khi nộp lưu.  Sinh viên được gia hạn thời gian thực hiện đề tài khóa luận không quá 2 lần. Trường hợp đặc biệt do Trưởng khoa quyết định trên cơ sở đề xuất của sinh viên và giảng viên hướng dẫn. Sinh viên phải đóng lại học phí khi gia hạn đề tài khóa luận."
làm thế nào để chủ tịch hội đồng tổ chức thảo luận để quyết định trường hợp các điểm thành phần chênh lệch nhau,Không có thông tin
trường hợp các điểm thành phần của khóa luận chênh lệch nhau trên 3 điểm thì phải làm sao,Không có thông tin
trường hợp nào thì chủ tịch hội đồng cần tổ chức thảo luận để quyết định,Không có thông tin
kết luận của chủ tịch hội đồng là gì,Không có thông tin
quyết định cuối cùng của chủ tịch hội đồng đúng không,Không có thông tin
kết luận của chủ tịch hội đồng là quyết định cuối cùng đúng không,Không có thông tin
"những gì sinh viên có trách nhiệm thảo luận với giảng viên hướng dẫn, giải trình và chỉnh sửa theo góp ý của hội đồng đánh giá trước khi nộp lưu",Không có thông tin
"một sinh viên có trách nhiệm thảo luận với giảng viên hướng dẫn, giải trình và chỉnh sửa theo góp ý của hội đồng đánh giá trước khi nộp lưu không",Không có thông tin
"những gì sinh viên có trách nhiệm thảo luận với giảng viên hướng dẫn, giải trình và chỉnh sửa theo góp ý của hội đồng đánh giá trước khi nộp lưu?",Không có thông tin
"sinh viên có trách nhiệm thảo luận với giảng viên hướng dẫn, giải trình và chỉnh sửa theo góp ý của hội đồng đánh giá trước khi nộp lưu không",Không có thông tin
"một sinh viên có trách nhiệm thảo luận với giảng viên hướng dẫn, giải trình và chỉnh sửa theo góp ý của hội đồng đánh giá trước khi nộp lưu không?",Không có thông tin
sinh viên được gia hạn thời gian thực hiện đề tài khóa luận không quá 2 lần đúng không,Không có thông tin
sinh viên được gia hạn thời gian thực hiện đề tài khóa luận mấy lần,Không có thông tin
sinh viên có được gia hạn thời gian thực hiện đề tài khóa luận không,Không có thông tin
có thể gia hạn thời gian thực hiện đề tài khóa luận không,Không có thông tin
sinh viên có thể gia hạn thời gian thực hiện đề tài khóa luận không,Không có thông tin
trường hợp đặc biệt do Trưởng khoa quyết định trên cơ sở để xuất của sinh viên và giảng viên hướng dẫn đúng không,Không có thông tin
sinh viên phải đóng lại học phí khi gia hạn đề tài khóa luận đúng không,Không có thông tin
có phải đóng lại học phí khi gia hạn đề tài khóa luận không,Không có thông tin
gia hạn đề tài khóa luận có mất tiền không,Không có thông tin
sinh viên phải làm gì khi gia hạn đề tài khóa luận,Không có thông tin
điều gì sẽ xảy ra nếu sinh viên không hoàn thành đề tài khóa luận đã được phân công,Không có thông tin
điều gì sẽ xảy ra nếu sinh viên không hoàn thành đề tài khóa luận đã được phân công hoặc nhận điểm f,Không có thông tin
sinh viên không hoàn thành đề tài khóa luận đã được phân công hoặc nhận điểm F khi báo cáo kết quả đề tài khóa luận có thể làm gì đề tài khác không,Không có thông tin
cách khắc phục khi sinh viên không thể hoàn thành để tài khóa luận đã được phân công hoặc nhận điểm F,Không có thông tin
điều gì sẽ xảy ra nếu sinh viên không hoàn thành đề tài khóa luận đã được phân công,Không có thông tin
tiêu chuẩn giảng viên hướng dẫn đề tài khóa luận là gì,"Giảng viên cơ hữu đủ tiêu chuẩn lên lớp lý thuyết mới được hướng dẫn đề tài khóa luận; người công tác ngoài trường phải có trình độ Thạc sĩ trở lên, công tác trong lĩnh vực nghiên cứu ít nhất 03 (ba) năm trở lên; mỗi giảng viên hướng dẫn độc lập không quá 04 (bốn) đề tài khóa luận/ lớp/đợt phân công. Trường hợp đồng hướng dẫn, 01 (một) đề tài được tính quy đổi tương đương hướng dẫn độc lập 0,5 (không phẩy năm) đề tài."
điều kiện để giảng viên đủ tiêu chuẩn để được thực hiện hướng dẫn đề tài khóa luận,"Dựa trên tài liệu cung cấp, điều kiện để giảng viên đủ tiêu chuẩn hướng dẫn đề tài khóa luận là:

a) **Đối với giảng viên cơ hữu:** Phải đủ tiêu chuẩn lên lớp lý thuyết.  (Tài liệu 3c, 3a)

b) **Đối với người công tác ngoài trường:** Phải có trình độ Thạc sĩ trở lên và có kinh nghiệm công tác trong lĩnh vực nghiên cứu ít nhất 3 năm. (Tài liệu 3b, 3c)

c) **Số lượng đề tài:** Mỗi giảng viên hướng dẫn độc lập không quá 4 đề tài khóa luận/lớp/đợt.  Nếu đồng hướng dẫn, 1 đề tài được tính là 0.5 đề tài. (Tài liệu 3c)"
phải có bằng cấp gì để trở thành một giảng viên hướng dẫn đề tài khóa luận,Không có thông tin
giảng viên cơ hữu phải đủ tiêu chuẩn nào mới được hướng dẫn đề tài khóa luận,Giảng viên cơ hữu phải đủ tiêu chuẩn lên lớp lý thuyết mới được hướng dẫn đề tài khóa luận. (Tài liệu 3a)
người công tác ngoài trường phải có trình độ nào để được hướng dẫn đề tài khóa luận,Không có thông tin
"khi đồng hướng dẫn một đề tài, mỗi hướng dẫn viên được tính bao nhiêu đề tài quy đổi tương đương hướng dẫn độc lập",Không có thông tin
"trong trường hợp đồng hướng dẫn, một đề tài được quy đổi tương đương với bao nhiêu phần trăm của một đề tài hướng dẫn độc lập",Không có thông tin
"nếu một hướng dẫn viên đồng hướng dẫn 2 đề tài, tổng số đề tài quy đổi tương đương hướng dẫn độc lập là bao nhiêu","1 đề tài tương đương 0,5 đề tài hướng dẫn độc lập, nên 2 đề tài tương đương 1 đề tài hướng dẫn độc lập."
"để được tính tương đương với 1 đề tài hướng dẫn độc lập, cần đồng hướng dẫn bao nhiêu đề tài",2 đề tài.
một hướng dẫn viên cần đồng hướng dẫn bao nhiêu đề tài để đạt được số đề tài quy đổi tương đương với 3 đề tài hướng dẫn độc lập,6 đề tài.
khi nào sinh viên được xét và công nhận tốt nghiệp,"Sinh viên được xét và công nhận tốt nghiệp khi: tích lũy đủ học phần, số tín chỉ và hoàn thành các nội dung bắt buộc khác theo yêu cầu của CTĐT, đạt các chuẩn đầu ra của CTĐT; hoàn thành các chuẩn đầu ra Ngoại ngữ không chuyên và chuẩn đầu ra Tin học không chuyên theo quy định của Trường; điểm trung bình tích lũy của toàn khóa học đạt từ trung bình trở lên (≥ 2,00 trở lên theo thang điểm 4); tại thời điểm xét tốt nghiệp không bị truy cứu trách nhiệm hình sự hoặc không đang trong thời gian bị kỷ luật ở mức đình chỉ học tập.  Hàng năm, sinh viên được xét tốt nghiệp vào tuần thứ 2 các tháng 03, 06, 09, 12.  Sinh viên chỉ được xét tốt nghiệp chương trình thứ hai nếu đủ điều kiện tốt nghiệp chương trình thứ nhất và đã đăng kí muộn nhất 02 năm trước thời điểm xét tốt nghiệp chương trình thứ hai."
khi nào sinh viên được xét và cấp bằng tốt nghiệp,"Sinh viên được xét tốt nghiệp khi tích lũy đủ học phần, số tín chỉ và hoàn thành các nội dung bắt buộc khác theo yêu cầu của CTĐT, đạt các chuẩn đầu ra của CTĐT; hoàn thành các chuẩn đầu ra Ngoại ngữ không chuyên và chuẩn đầu ra Tin học không chuyên theo quy định của Trường; điểm trung bình tích lũy của toàn khóa học đạt từ trung bình trở lên (≥ 2,00 trở lên theo thang điểm 4); tại thời điểm xét tốt nghiệp không bị truy cứu trách nhiệm hình sự hoặc không đang trong thời gian bị kỷ luật ở mức đình chỉ học tập. Hàng năm, sinh viên được xét tốt nghiệp vào tuần thứ 2 các tháng 03, 06, 09, 12."
điều 20 trong quy chế học vụ,Không có thông tin
khi nào thì sinh viên được xét và công nhận tốt nghiệp,"Sinh viên được xét và công nhận tốt nghiệp khi: tích lũy đủ học phần, số tín chỉ và hoàn thành các nội dung bắt buộc khác theo yêu cầu của CTĐT, đạt các chuẩn đầu ra của CTĐT; hoàn thành các chuẩn đầu ra Ngoại ngữ không chuyên và chuẩn đầu ra Tin học không chuyên theo quy định của Trường; điểm trung bình tích lũy của toàn khóa học đạt từ trung bình trở lên (≥ 2,00 trở lên theo thang điểm 4); tại thời điểm xét tốt nghiệp không bị truy cứu trách nhiệm hình sự hoặc không đang trong thời gian bị kỷ luật ở mức đình chỉ học tập.  Hàng năm, sinh viên được xét tốt nghiệp vào tuần thứ 2 các tháng 03, 06, 09, 12.  Sinh viên chỉ được xét tốt nghiệp chương trình thứ hai nếu đủ điều kiện tốt nghiệp chương trình thứ nhất và đã đăng ký chương trình thứ hai ít nhất 2 năm trước khi xét tốt nghiệp chương trình thứ hai."
"trong một năm, có bao nhiêu lần sinh viên được xét và công nhận tốt nghiệp",Không có thông tin
sinh viên cần phải tích lũy đủ những điều kiện nào để được xét và công nhận tốt nghiệp,"Sinh viên được xét và công nhận tốt nghiệp khi: a) Tích lũy đủ học phần, số tín chỉ và hoàn thành các nội dung bắt buộc khác theo yêu cầu của CTĐT, đạt các chuẩn đầu ra của CTĐT; hoàn thành các chuẩn đầu ra Ngoại ngữ không chuyên và chuẩn đầu ra Tin học không chuyên theo quy định của Trường. b) Điểm trung bình tích lũy của toàn khóa học đạt từ trung bình trở lên (≥ 2,00 trở lên theo thang điểm 4); c) Tại thời điểm xét tốt nghiệp không bị truy cứu trách nhiệm hình sự hoặc không đang trong thời gian bị kỷ luật ở mức đình chỉ học tập."
làm thế nào để sinh viên được xét và công nhận tốt nghiệp,"Sinh viên được xét tốt nghiệp vào tuần thứ hai của tháng 3, 6, 9 và 12 hàng năm.  Những sinh viên đủ điều kiện tốt nghiệp được Hiệu trưởng ra quyết định công nhận tốt nghiệp và cấp bằng tốt nghiệp trong thời hạn 03 tháng tính từ thời điểm sinh viên đáp ứng đầy đủ điều kiện tốt nghiệp và hoàn thành nghĩa vụ với trường."
điểm trung bình tích lũy của toàn khóa học cần đạt mức tối thiểu bao nhiêu để sinh viên được xét tốt nghiệp,Không có thông tin
sinh viên cần hoàn thành những chuẩn đầu ra nào theo quy định của Trường để được xét tốt nghiệp,"Sinh viên phải tích lũy đủ học phần, số tín chỉ và hoàn thành các nội dung bắt buộc khác theo yêu cầu của CTĐT, đạt các chuẩn đầu ra của CTĐT; hoàn thành các chuẩn đầu ra Ngoại ngữ không chuyên và chuẩn đầu ra Tin học không chuyên theo quy định của Trường."
làm thế nào để được tốt nghiệp,"Để tốt nghiệp, sinh viên cần đáp ứng các điều kiện sau:

* **Đối với chương trình thứ hai:** Sinh viên phải tốt nghiệp chương trình thứ nhất và đã đăng ký chương trình thứ hai ít nhất 2 năm trước khi xét tốt nghiệp chương trình thứ hai.  (Tài liệu 6)
* **Thời gian xét tốt nghiệp:** Sinh viên được xét tốt nghiệp vào tuần thứ hai của tháng 3, 6, 9 và 12 hàng năm. (Tài liệu 1)
* **Xử lý trường hợp vắng thi:**  Trong thời gian thi kết thúc học phần, sinh viên có lý do chính đáng không thể dự thi, được Trưởng Khoa/Bộ môn chấp thuận thì sẽ hưởng điểm I.  Vắng mặt không lý do sẽ bị điểm 0. (Tài liệu 1)"
thời hạn công nhận tốt nghiệp và cấp bằng tốt nghiệp là bao lâu kể từ thời điểm sinh viên đáp ứng đầy đủ điều kiện,Không có thông tin
ai là người ra quyết định công nhận tốt nghiệp và cấp bằng tốt nghiệp cho sinh viên đủ điều kiện,Hiệu trưởng ra quyết định công nhận tốt nghiệp và cấp bằng tốt nghiệp cho sinh viên đủ điều kiện.  (Tài liệu 3)
quyết định công nhận tốt nghiệp và cấp bằng tốt nghiệp được ra trong vòng bao lâu sau khi sinh viên hoàn thành nghĩa vụ với Trường,Không có thông tin
sinh viên phải đáp ứng những điều kiện gì để được công nhận tốt nghiệp và cấp bằng tốt nghiệp,"Để được công nhận tốt nghiệp và cấp bằng tốt nghiệp, sinh viên phải đủ điều kiện tốt nghiệp và hoàn thành nghĩa vụ với trường (Tài liệu 3).  Điều kiện đăng ký học chương trình thứ hai bao gồm: đạt trình độ năm thứ hai chương trình hiện tại, có học lực khá trở lên hoặc trung bình và đáp ứng điều kiện tuyển sinh của chương trình thứ hai; chương trình thứ hai phải còn khả năng tiếp nhận (Tài liệu 2).  Để công nhận học phần tích lũy từ cơ sở đào tạo khác, sinh viên phải đăng ký và được Hiệu trưởng đồng ý trước khi học, kèm theo minh chứng hợp lệ (Tài liệu 2)."
hiệu trưởng có bao nhiêu thời gian để ra quyết định công nhận tốt nghiệp sau khi sinh viên hoàn thành nghĩa vụ với Trường,Không có thông tin
sinh viên không tốt nghiệp sẽ được cấp chứng nhận về điều gì?,"Sinh viên tốt nghiệp được cấp bằng tốt nghiệp, bảng điểm học tập và rèn luyện, hồ sơ sinh viên, và các giấy tờ có liên quan khác. (Tài liệu không có số thứ tự)  Sinh viên không tốt nghiệp được cấp chứng nhận về các học phần đã tích lũy trong CTĐT của ngành/chuyên ngành. (Tài liệu 4)"
"Nếu sinh viên không tốt nghiệp, họ sẽ nhận được chứng nhận liên quan đến những gì trong CTĐT?","Sinh viên tốt nghiệp sẽ nhận được chứng nhận về việc đã tích lũy đủ học phần, số tín chỉ và hoàn thành các nội dung bắt buộc khác theo yêu cầu của CTĐT, đạt các chuẩn đầu ra của CTĐT; hoàn thành các chuẩn đầu ra Ngoại ngữ không chuyên và chuẩn đầu ra Tin học không chuyên theo quy định của trường. (Tài liệu 2)  Sinh viên không tốt nghiệp được cấp chứng nhận về các học phần đã tích lũy trong CTĐT của ngành/chuyên ngành. (Tài liệu 4)"
"khi không tốt nghiệp, sinh viên sẽ được cấp chứng nhận về các học phần tích luỹ trong CTĐT của ngành hoặc chuyên ngành nào?",Sinh viên không tốt nghiệp được cấp chứng nhận về các học phần đã tích lũy trong CTĐT của ngành/chuyên ngành. (Tài liệu 4)
hội đồng nào xét tốt nghiệp cho sinh viên đủ điều kiện tốt nghiệp?,Không có thông tin
hội đồng xét tốt nghiệp Khoa phải chuyển Biên bản xét tốt nghiệp về Hội đồng xét tốt nghiệp Trường trước ngày nào của các tháng quy định?,"Biên bản xét tốt nghiệp phải chuyển trước ngày 01 của các tháng 03, 06, 09 và 12."
sinh viên có nhu cầu tốt nghiệp khác tiến độ đã được thiết kế phải làm gì?,Không có thông tin
"quy trình, thủ tục xét và công nhận tốt nghiệp là gì","Hội đồng xét tốt nghiệp Khoa xét tốt nghiệp cho sinh viên đủ điều kiện, đúng thời hạn và chuyển Biên bản xét tốt nghiệp về Hội đồng xét tốt nghiệp Trường trước ngày 01 các tháng 3, 6, 9 và 12.  Sinh viên cần tốt nghiệp khác tiến độ đã thiết kế phải làm đơn đề nghị xét/chưa xét công nhận tốt nghiệp, gửi về Hội đồng xét tốt nghiệp Khoa. Hiệu trưởng ký quyết định công nhận tốt nghiệp cho sinh viên đủ điều kiện. Danh sách công bố trên website Phòng Đào tạo; sinh viên kiểm tra thông tin, báo sai sót trong 7 ngày. Sinh viên được nhận bằng tốt nghiệp và phụ lục; có thể đăng ký giấy chứng nhận tốt nghiệp tạm thời."
sinh viên cần làm gì nếu phát hiện sai sót trong danh sách công nhận tốt nghiệp,Không có thông tin
sinh viên có thể đăng ký nhận thêm những tài liệu gì theo nhu cầu cá nhân,Sinh viên được cung cấp tài liệu học tập.
sinh viên cần đăng ký nhận thêm bản sao bằng tốt nghiệp và bản sao phụ lục văn bằng ở đâu,Điều 20: công nhận tốt nghiệp và cấp bằng tốt nghiệp bao gồm bản sao bằng tốt nghiệp và bản sao phụ lục văn bằng theo nhu cầu cá nhân.
"nếu sinh viên muốn có thêm bản sao phụ lục văn bằng, họ phải làm gì",Không có thông tin
phòng nào chịu trách nhiệm cung cấp bản sao bằng tốt nghiệp và bản sao phụ lục văn bằng cho sinh viên,Không có thông tin
bằng tốt nghiệp đại học được cấp theo gì?,Bằng tốt nghiệp đại học được cấp khi sinh viên đáp ứng đầy đủ các điều kiện sau:  hoàn tất các thủ tục theo yêu cầu của trường; đạt điểm trung bình tích lũy (ĐTBCTL) từ 2.00 (theo thang điểm 4); hoàn thành các nội dung bắt buộc theo yêu cầu của chương trình đào tạo (CTĐT);  đạt chuẩn đầu ra của CTĐT (bao gồm cả chuẩn đầu ra ngoại ngữ không chuyên và tin học không chuyên); tổng số tín chỉ không đạt không vượt quá 5% tổng số tín chỉ quy định cho toàn CTĐT;  đã hoàn thành khóa luận/tiểu luận tốt nghiệp (nếu có).  Hiệu trưởng ký quyết định công nhận tốt nghiệp.
xếp loại tốt nghiệp dựa trên gì?,"Xếp loại tốt nghiệp được xác định căn cứ vào điểm trung bình tích lũy (ĐTBCTL):  3,60 đến 4,00 là loại xuất sắc; 3,20 đến 3,59 là loại giỏi; 2,50 đến 3,19 là loại khá; 2,00 đến 2,49 là loại trung bình.  Hạng tốt nghiệp có thể bị giảm một mức nếu có quá 5% học phần học lại (chỉ tính học phần bắt buộc) hoặc bị kỷ luật từ mức cảnh cáo trở lên."
ngành đào tạo có vai trò gì trong việc cấp bằng tốt nghiệp đại học,Bằng tốt nghiệp đại học được cấp theo ngành đào tạo.
sinh viên sẽ nhận bằng tốt nghiệp theo tiêu chí nào,Không có thông tin
"bằng tốt nghiệp, xếp loại tốt nghiệp",Không có thông tin
xếp loại tốt nghiệp được xác định căn cứ vào đâu,"Xếp loại tốt nghiệp được xác định căn cứ vào điểm trung bình tích lũy (ĐTBCTL): loại xuất sắc (ĐTBCTL từ 3,60 đến 4,00); loại giỏi (ĐTBCTL từ 3,20 đến 3,59); loại khá (ĐTBCTL từ 2,50 đến 3,19); loại trung bình (ĐTBCTL từ 2,00 đến 2,49).  Hạng tốt nghiệp của sinh viên có kết quả loại xuất sắc và giỏi có thể bị giảm một mức nếu có học phần học lại vượt quá 5% tổng số tín chỉ hoặc bị kỷ luật từ mức cảnh cáo trở lên."
