question,answer
giới thiệu về Trường Đại học Nông Lâm Thành phố Hồ Chí Minh,"Trường Đại học Nông Lâm Thành phố Hồ Chí Minh có cấu trúc tổ chức gồm 12 phòng ban, 7 trung tâm, 1 viện nghiên cứu, 12 khoa đào tạo chuyên môn, 1 khoa cơ bản và 1 bộ môn.  Trường có Phân hiệu tại Gia Lai, địa chỉ: Đường Trần Nhật Duật, Thông 01, Xã Diên Phú, Thành phố Pleiku, Tỉnh Gia Lai, điện thoại: 0269.3877.035, website: https://phgl.hcmuaf.edu.vn/, email: phgl@hcmuaf.edu.vn.  Hội Sinh viên trường quản lý Đội Công tác xã hội, thực hiện các hoạt động tình nguyện xã hội, do Võ Công Thương làm đội trưởng."
lịch sử hình thành của trường Đại học Nông Lâm Thành phố Hồ Chí Minh,"Trường Đại học Nông Lâm Thành phố Hồ Chí Minh (NLU) có lịch sử hình thành và phát triển gần 70 năm, trải qua các giai đoạn đổi tên sau: Trường Quốc gia Nông Lâm Mục Blao (1955), Trường Cao đẳng Nông Lâm Súc (1963), Học viện Quốc gia Nông nghiệp Sài Gòn (1972), Trường Đại học Nông nghiệp 4 (1975), Trường Đại học Nông Lâm nghiệp TP. Hồ Chí Minh (1985), Trường Đại học Nông Lâm (thành viên của Đại học Quốc gia TP. Hồ Chí Minh) (1995), và cuối cùng là Trường Đại học Nông Lâm TP. Hồ Chí Minh (2000). Trường đạt nhiều thành tích xuất sắc về đào tạo, nghiên cứu và ứng dụng khoa học kỹ thuật nông lâm ngư nghiệp, chuyển giao công nghệ, và quan hệ quốc tế."
cơ sở vật chất của trường Đại học Nông Lâm Thành phố Hồ Chí Minh,"Cơ sở vật chất của Trường Đại học Nông Lâm Thành phố Hồ Chí Minh bao gồm 6 giảng đường, 10 trung tâm, 01 viện nghiên cứu và ứng dụng, 01 thư viện trung tâm (trên 15.000 đầu sách), 01 bệnh viện thú y, 01 xưởng dược thú y, 01 trại thực nghiệm thủy sản, 04 trung tâm nghiên cứu thí nghiệm (nông học, lâm nghiệp, nuôi trồng thủy sản, chăn nuôi), và thư viện điện tử.  Trường có 6 ký túc xá (350 phòng, sức chứa 3.000 sinh viên), 1 sân đa môn, 3 sân bóng chuyền, 1 sân bóng đá, và nhà thi đấu thể thao (sức chứa 1.000 người)."
các đơn vị trong trường Đại học Nông Lâm Thành phố Hồ Chí Minh là gì,"Trường Đại học Nông Lâm TP. Hồ Chí Minh gồm có 12 phòng ban, 7 trung tâm, 1 viện nghiên cứu, 12 khoa đào tạo chuyên môn, 1 khoa cơ bản và 1 bộ môn."
các chương trình tiên tiến tại Đại học Nông Lâm TPHCM là gì,"Trường Đại học Nông Lâm TP.HCM có các chương trình đào tạo tiên tiến về Bác sĩ thú y và Công nghệ thực phẩm.  Ngoài ra, trường còn có các chương trình nâng cao về Quản trị kinh doanh, Công nghệ sinh học, Công nghệ kỹ thuật cơ khí, Công nghệ thực phẩm, Công nghệ kỹ thuật hóa học và Chăn nuôi."
các chương trình tiên tiến tại Đại học Nông Lâm TPHCM là gì,"Trường Đại học Nông Lâm TP.HCM có các chương trình đào tạo tiên tiến về Bác sĩ thú y và Công nghệ thực phẩm.  Ngoài ra, trường còn có các chương trình nâng cao về Quản trị kinh doanh, Công nghệ sinh học, Công nghệ kỹ thuật cơ khí, Công nghệ thực phẩm, Công nghệ kỹ thuật hóa học và Chăn nuôi."
các ngành đào tạo tại Phân hiệu Gia Lai thuộc trường Đại học Nông Lâm TPHCM là gì,"Phân hiệu Gia Lai của Đại học Nông Lâm TP.HCM đào tạo các ngành: quản trị kinh doanh, bất động sản, kế toán, công nghệ sinh học, nông học, lâm nghiệp đô thị, thú y và tài nguyên & du lịch sinh thái."
các ngành đào tạo tại Phân hiệu Ninh Thuận thuộc trường Đại học Nông Lâm TPHCM là gì,"Phân hiệu Ninh Thuận của Đại học Nông Lâm TP.HCM đào tạo các ngành giáo dục mầm non (CĐ & ĐH), ngôn ngữ Anh, quản trị kinh doanh, kế toán, công nghệ thông tin, công nghệ kỹ thuật năng lượng tái tạo và thú y."
quỹ tín dụng học tập dành cho sinh viên là gì và nội dung của Quỹ Tín dụng học tập là gì,"Quỹ Tín dụng học tập dành cho sinh viên được thành lập từ năm 1998, do Ngân hàng Chính sách Xã hội (NHCSXH) quản lý.  Mục đích là giúp sinh viên có hoàn cảnh khó khăn vay vốn để trang trải chi phí học tập và sinh hoạt, bao gồm tiền học phí, mua sắm phương tiện học tập, sách vở, ăn ở và đi lại.  Trường Đại học Nông Lâm TP.HCM xác nhận hồ sơ cho khoảng 3.000 sinh viên mỗi năm để vay vốn từ quỹ này."
đối tượng sinh viên được hỗ trợ vay tiền của quỹ tín dụng học tập là gì,"Đối tượng sinh viên được hỗ trợ vay tiền từ Quỹ tín dụng học tập gồm: sinh viên mồ côi (cả cha lẫn mẹ hoặc chỉ mồ côi một bên nếu người còn lại không có khả năng lao động); sinh viên thuộc hộ gia đình cận nghèo, nghèo, hoặc có mức sống trung bình theo quy định pháp luật; và sinh viên có gia đình gặp khó khăn về tài chính đột xuất do bệnh tật, tai nạn, hỏa hoạn, thiên tai, dịch bệnh (có xác nhận của chính quyền địa phương)."
điều kiện để được hỗ trợ vay tiền sinh viên của quỹ tín dụng học tập là gì,"Điều kiện để sinh viên được hỗ trợ vay tiền từ Quỹ tín dụng học tập gồm:  sinh viên thuộc đối tượng được hỗ trợ (xem câu trả lời trước); sinh viên năm nhất phải có giấy báo trúng tuyển; sinh viên năm thứ hai trở lên phải có giấy xác nhận của trường về việc đang theo học và không bị xử phạt vi phạm hành chính trở lên về các hành vi cờ bạc, nghiện hút, trộm cắp và buôn lậu."
mức tiền và lãi suất hỗ trợ vay tiền sinh viên của quỹ tín dụng học tập là gì,"Mức vay tối đa của Quỹ tín dụng học tập là 4.000.000 đồng/tháng/sinh viên. Lãi suất ưu đãi là 0,65%/tháng.  Lãi suất nợ quá hạn là 130% lãi suất cho vay."
phương thức cho vay tiền sinh viên của quỹ tín dụng học tập là gì,Phương thức vay vốn Quỹ tín dụng học tập được thực hiện thông qua hộ gia đình (hộ gia đình chịu trách nhiệm trả nợ). Sinh viên mồ côi cả cha lẫn mẹ hoặc mồ côi một bên (người còn lại không có khả năng lao động) được vay và trả nợ trực tiếp tại Ngân hàng Chính sách xã hội địa phương nơi trường đóng trụ sở. Sinh viên đăng ký Giấy xác nhận vay vốn trực tuyến tại https://nlsonline.hcmuaf.edu.vn/gxn/dangnhap.php
các loại giấy tờ được xác nhận khi làm hồ sơ sinh viên tại trường Đại học Nông Lâm là gì,"Phòng công tác sinh viên của trường Đại học Nông Lâm xác nhận các loại giấy tờ sau: vay vốn ngân hàng chính sách xã hội, tạm hoãn nghĩa vụ quân sự, đi xe buýt, bổ sung hồ sơ nhận trợ cấp, bổ sung hồ sơ làm lại thẻ sinh viên, bổ sung hồ sơ thuế cho người thân, bổ sung hồ sơ ký túc xá Đại học Quốc gia TP.HCM, bổ sung hồ sơ thi học kỳ, thi acces, bổ sung hồ sơ lý lịch cá nhân, bổ sung hồ sơ nhận học bổng, bổ sung hồ sơ giảm trừ gia cảnh, bổ sung hồ sơ đi làm, và bổ sung hồ sơ đi thực tập."
quy trình xác nhận hồ sơ sinh viên là gì,"Quy trình xác nhận hồ sơ sinh viên gồm các bước:  1. Sinh viên truy cập https://nlsonline.hcmuaf.edu.vn/gxn/dangnhap.php và đăng nhập hệ thống; 2. Kiểm tra và cập nhật thông tin cá nhân; 3. Đăng ký giấy xác nhận; 4. Cán bộ phòng Công tác Sinh viên in, ký, đóng dấu giấy xác nhận; 5. Sinh viên nhận giấy xác nhận theo thời gian được hệ thống thông báo."
cách thanh toán học phí tại quầy giao dịch của BIDV là gì,"Để thanh toán học phí tại quầy giao dịch BIDV, sinh viên cần đến quầy giao dịch của BIDV trên toàn quốc và cung cấp mã sinh viên. Giao dịch viên sẽ thông báo chi tiết hóa đơn, số tiền phải nộp, xử lý giao dịch, và in chứng từ. Sinh viên sẽ nhận lại 1 liên chứng từ đã thanh toán, có đầy đủ dấu và chữ ký của cán bộ BIDV."
cách thanh toán học phí qua kênh BIDV Smart banking là gì,"Để thanh toán học phí qua BIDV Smart Banking, sinh viên cần: 1. Đăng nhập ứng dụng BIDV Smart Banking trên điện thoại di động bằng số điện thoại và mật khẩu; 2. Chọn mục thanh toán “Học phí_Lệ phí thi”; 3. Chọn nhà cung cấp, nhập mã sinh viên và nhấn “Tiếp tục”; 4. Xác nhận thanh toán và nhập mã OTP; 5. Thông tin giao dịch sẽ được lưu trong mục “Báo cáo giao dịch”."
cách thanh toán học phí qua kênh BIDVOnline là gì,"Để thanh toán học phí qua BIDV Online, sinh viên cần: 1. Truy cập website BIDV tại www.bidv.com.vn và đăng nhập tài khoản cá nhân; 2. Chọn “Thanh toán hóa đơn → Thanh toán hóa đơn từng lần”; 3. Chọn số hóa đơn cần thanh toán; 4. Xác nhận thanh toán và nhập mã OTP; 5. Thông tin giao dịch sẽ được lưu trong mục Hộp thư/Hộp thư đến."
cách thanh toán học phí qua ATM của BIDV là gì,"Để thanh toán học phí qua ATM BIDV, sinh viên cần: 1. Đăng nhập vào hệ thống ATM BIDV; 2. Chọn menu “Thanh toán”; 3. Chọn tài khoản thanh toán; 4. Chọn menu “Học phí - Lệ phí thi”; 5. Chọn “Trường Đại học Nông Lâm TP.HCM” làm nhà cung cấp dịch vụ; 6. Nhập mã sinh viên vào mục “Mã khách hàng”; 7. Kiểm tra thông tin và chọn “Có” để xác nhận; 8. Nhận phản hồi và in biên lai.  Lưu ý: Không được thanh toán bằng hình thức chuyển khoản."
cách thanh toán học phí qua website sinh viên là gì,"Để thanh toán học phí qua website sinh viên, sinh viên cần: 1. Đăng nhập vào trang web đăng ký môn học: https://dkmh.hcmuaf.edu.vn/; 2. Chọn “Đóng tiền học phí” và chọn hóa đơn cần đóng; 3. Chọn “Thanh toán học phí qua BIDV”; 4. Chọn hình thức thanh toán và điền thông tin; 5. Xác nhận; 6. Nhập mã OTP và chọn “xác nhận” để hoàn tất giao dịch."
yêu cầu chuẩn đầu ra tin học không chuyên của ngành Chăn nuôi - Thú Y là gì,Không có thông tin
yêu cầu chuẩn đầu ra tin học không chuyên của ngành Cơ khí - Công nghệ là gì,Không có thông tin
yêu cầu chuẩn đầu ra tin học không chuyên của ngành Công nghệ hóa học là gì,Không có thông tin
yêu cầu chuẩn đầu ra tin học không chuyên của ngành Công nghệ sinh học là gì,Không có thông tin
yêu cầu chuẩn đầu ra tin học không chuyên của ngành Công nghê thực phẩm là gì,Không có thông tin
yêu cầu chuẩn đầu ra tin học không chuyên của ngành Kinh tế là gì,Không có thông tin
yêu cầu chuẩn đầu ra tin học không chuyên của ngành Lâm nghiệp là gì,Không có thông tin
yêu cầu chuẩn đầu ra tin học không chuyên của ngành Môi trường và Tài nguyên là gì,Không có thông tin
yêu cầu chuẩn đầu ra tin học không chuyên của ngành Ngoại ngữ - Sư phạm là gì,Không có thông tin
yêu cầu chuẩn đầu ra tin học không chuyên của ngành Nông học là gì,Không có thông tin
yêu cầu chuẩn đầu ra tin học không chuyên của ngành Quản lý đất đai và bất động sản là gì,Không có thông tin
yêu cầu chuẩn đầu ra tin học không chuyên của ngành Thủy sản là gì,Không có thông tin
sinh viên có thể được xét miễn hai học phần tiếng Anh điều kiện và công nhận đạt chuẩn ngoại ngữ đầu ra nếu đáp ứng được 1 trong các điều kiện nào,Không có thông tin
chuẩn đầu ra ngoại ngữ trường Đại học Nông Lâm,Không có thông tin
chuẩn đầu ra tiếng anh trường Đại học Nông Lâm,Không có thông tin
điều 1 trong quy chế học vụ là gì,"Không có thông tin.  Các tài liệu cung cấp thông tin về quy trình đăng ký giấy xác nhận, phân bổ quỹ học bổng và quy trình đăng ký học phần, nhưng không có thông tin về nội dung của điều 1 trong quy chế học vụ."
phạm vi điều chỉnh và đối tượng áp dụng quy chế học vụ của trường đại học nông lâm thành phố hồ chí minh là gì,"Không có thông tin. Các tài liệu cung cấp thông tin về cơ chế đảm bảo sử dụng hệ thống đào tạo trực tuyến, cấu trúc tổ chức của trường Đại học Nông Lâm TP. HCM và các ngành đào tạo tại Phân hiệu Ninh Thuận, nhưng không đề cập đến phạm vi điều chỉnh và đối tượng áp dụng của quy chế học vụ."
đối tượng áp dụng quy chế học vụ của trường đại học nông lâm thành phố hồ chí minh là gì,"Không có thông tin. Tài liệu cung cấp thông tin về điều kiện nghỉ học tạm thời và thôi học, cũng như điều kiện học cùng lúc hai chương trình, nhưng không nêu rõ đối tượng áp dụng chung của toàn bộ quy chế học vụ."
những gì được coi là một chương trình đào tạo được thiết kế và tổ chức thực hiện nhằm đạt được các mục tiêu của một văn bằng giáo dục đại học,"Không có thông tin.  Các tài liệu tập trung vào quy trình đăng ký học phần, tư vấn học tập và cách tính điểm, chứ không giải thích định nghĩa về chương trình đào tạo đạt mục tiêu văn bằng đại học."
chương trình đào tạo là gì,"Chương trình đào tạo là vấn đề cần trao đổi trực tiếp với khoa chuyên môn. Giáo viên chủ nhiệm/cố vấn học tập cũng tư vấn về chuyên ngành đào tạo, bao gồm mục tiêu đào tạo và cơ hội việc làm.  Phòng đào tạo công bố học phần và số lớp học phần dự kiến mở trong học kỳ tiếp theo dựa trên chương trình đào tạo của các ngành/chuyên ngành."
điều 2 trong quy chế học vụ là gì,"Không có thông tin. Các tài liệu cung cấp thông tin về điều kiện mở thêm lớp học phần, cách xếp loại học lực và quy trình đăng ký học phần, nhưng không đề cập đến nội dung của điều 2 trong quy chế học vụ."
mục tiêu của một chương trình đào tạo là gì,"Không có thông tin.  Các tài liệu đề cập đến thủ tục đăng ký học chương trình thứ hai, quy định bảo lưu và chuyển điểm học phần, và tiêu chuẩn giảng viên hướng dẫn đề tài khóa luận, nhưng không nêu rõ mục tiêu của một chương trình đào tạo."
chương trình đào tạo bao gồm những gì,"Dựa trên tài liệu, chương trình đào tạo bao gồm các chương trình tiên tiến như Bác sĩ thú y và Công nghệ thực phẩm tại trường chính.  Phân hiệu Ninh Thuận có các chương trình đào tạo về Giáo dục Mầm non (Cao đẳng & Đại học), Ngôn ngữ Anh, Quản trị kinh doanh, Kế toán, Công nghệ thông tin, Công nghệ kỹ thuật năng lượng tái tạo và Thú y.  Quy trình đăng ký học phần bao gồm các bước công bố học phần, đề xuất điều chỉnh, sinh viên đăng ký trực tuyến và xem thời khóa biểu."
"chương trình đào tạo nào bao gồm mục tiêu, khối lượng kiến thức, cấu trúc, nội dung, phương pháp và hình thức đánh giá đối với các môn học và ngành học?","Dựa trên tài liệu, chương trình đào tạo bao gồm các học phần được công bố bởi Phòng Đào tạo dựa trên CTĐT của từng ngành/chuyên ngành.  Mục tiêu đào tạo và cơ hội việc làm được giáo viên chủ nhiệm/cố vấn học tập tư vấn.  Việc công nhận học phần tích lũy từ các cơ sở đào tạo khác xét dựa trên chuẩn đầu ra CTĐT, nội dung, khối lượng học tập và cách thức đánh giá.  Khối lượng tối đa được công nhận không quá 50% tổng chương trình.  Tài liệu không cung cấp thông tin đầy đủ về cấu trúc, nội dung và phương pháp giảng dạy của toàn bộ chương trình đào tạo."
"những gì cần thiết để trở thành một chuẩn đầu ra trong một chương trình đào tạo là một yêu cầu cần đạt về phẩm chất, năng lực và trách nhiệm của người học sau khi tốt nghiệp","Không có thông tin. Tài liệu đề cập đến yêu cầu về học tập và rèn luyện của sinh viên, trách nhiệm của trường trong việc cung cấp chương trình đào tạo và kế hoạch học tập, nhưng không định nghĩa cụ thể về các yêu cầu cần thiết để trở thành một chuẩn đầu ra về phẩm chất, năng lực và trách nhiệm của người học sau tốt nghiệp."
chuẩn đầu ra yêu cầu những gì,"Chuẩn đầu ra về học tập tốt yêu cầu điểm trung bình tích lũy hoặc điểm trung bình học kỳ gần nhất đạt từ 7.3/10 và 2.9/4.0 trở lên (không có môn nào bị điểm F), sinh viên năm nhất điểm đầu vào trên 21 (không có môn nào dưới 6 điểm).  Ưu tiên sinh viên có thành tích nghiên cứu khoa học, thi học thuật, hoạt động câu lạc bộ, xuất bản bài viết hoặc có sản phẩm ứng dụng.  Đối với danh hiệu tốt nghiệp (thủ khoa, á khoa, xuất sắc, giỏi), điều kiện xét dựa trên điểm trung bình tích lũy (ĐTBTL) và điểm rèn luyện, số lượng sinh viên tốt nghiệp."
những gì cần thiết để trở thành một chuẩn đầu ra trong một chương trình đào tạo,"Không có thông tin. Tài liệu chỉ đề cập đến trách nhiệm của trường trong việc cung cấp chương trình đào tạo, kế hoạch học tập và tư vấn cho sinh viên,  và các vấn đề cần trao đổi với khoa chuyên môn và giáo viên chủ nhiệm, nhưng không nêu rõ những gì cần thiết để trở thành chuẩn đầu ra của chương trình đào tạo."
một chương trình đào tạo được xây dựng theo đơn vị tín chỉ là gì,"Không có thông tin. Tài liệu đề cập đến quy trình đăng ký học phần, trách nhiệm của khoa chuyên môn và hệ thống đào tạo trực tuyến, nhưng không mô tả chi tiết về việc xây dựng chương trình đào tạo theo đơn vị tín chỉ."
học phần là gì,"Học phần là đơn vị cấu thành chương trình đào tạo.  Điểm học phần lý thuyết/lý thuyết kết hợp thực hành được tính từ nhiều thành phần (bài tập, kiểm tra giữa kỳ, thi kết thúc học phần...), điểm học phần thực hành được tính theo điểm trung bình các bài thực hành. Trường sẽ mở thêm lớp học phần nếu có từ 30 sinh viên đăng ký và được hiệu trưởng chấp thuận. Phòng đào tạo sẽ điều chỉnh điểm học phần trong vòng 1 tuần nếu phát hiện sai sót."
"một chương trình đào tạo được xây dựng theo đơn vị tín chỉ và cấu trúc từ các môn học đối với các trình độ của giáo dục đại học, trong đó phải có đủ các học phần bắt buộc và tự chọn và thấm định và đáp ứng chuẩn ctdt là gì","Không có thông tin. Tài liệu đề cập đến quy trình đăng ký học phần, thủ tục đăng ký học chương trình thứ hai, và công nhận học phần tích lũy từ các cơ sở đào tạo khác. Tuy nhiên, tài liệu không mô tả chi tiết về cấu trúc chương trình đào tạo theo đơn vị tín chỉ, phân bổ học phần bắt buộc và tự chọn, cũng như cách thức chương trình đào tạo thấm định và đáp ứng chuẩn đầu ra."
sự khác biệt giữa đào tạo song ngành và ngành chính - phụ là gì,"Không có thông tin. Tài liệu liệt kê các ngành đào tạo tại phân hiệu Ninh Thuận và Gia Lai, cũng như thủ tục đăng ký học chương trình thứ hai, nhưng không cung cấp thông tin về sự khác biệt giữa đào tạo song ngành và ngành chính - phụ."
"trong trường hợp đào tạo song ngành hoặc ngành chính - ngành phụ, CTĐT phải như thế nào","Không có thông tin. Tài liệu cung cấp thông tin về các ngành đào tạo tại phân hiệu Ninh Thuận và Gia Lai, cũng như quy định về xét chuyển đổi chương trình đào tạo cho sinh viên bị buộc thôi học.  Tuy nhiên, tài liệu không mô tả cách thức xây dựng CTĐT trong trường hợp đào tạo song ngành hoặc ngành chính - ngành phụ."
những gì cần thiết để trở thành một nhà đào tạo song ngành hoặc ngành chính - ngành phụ,"Không có thông tin. Tài liệu nêu trách nhiệm của trường và vai trò của khoa chuyên môn, giáo viên chủ nhiệm trong việc cung cấp chương trình đào tạo và tư vấn học tập, nhưng không đề cập đến điều kiện hay yêu cầu để trở thành người đào tạo song ngành hoặc ngành chính - ngành phụ."
những gì cần thiết để lấy bằng tốt nghiệp,"Để tốt nghiệp, sinh viên cần hoàn thành các học phần theo quy định.  Sinh viên có lý do chính đáng không thể dự thi kết thúc học phần sẽ được điểm I, còn vắng thi không lý do sẽ bị điểm 0.  Việc xét học bổng khuyến khích học tập dựa trên điểm trung bình chung học bổng, điểm rèn luyện và các tiêu chuẩn khác.  Tài liệu không nêu rõ toàn bộ điều kiện tốt nghiệp."
"tích lũy đủ các học phần và chuẩn đầu ra của CTĐT, sinh viên sẽ được gì","Không có thông tin. Tài liệu đề cập đến quy trình đăng ký học phần và thông tin về phân hiệu Gia Lai, nhưng không nêu rõ sinh viên sẽ được gì sau khi tích lũy đủ học phần và đáp ứng chuẩn đầu ra của chương trình đào tạo."
sinh viên sẽ được xét và cấp bằng tốt nghiệp khi nào,"Sinh viên được xét và công nhận tốt nghiệp vào tuần thứ 2 các tháng 3, 6, 9, 12 hàng năm nếu đáp ứng đủ các điều kiện: tích lũy đủ học phần và số tín chỉ theo yêu cầu của CTĐT, đạt chuẩn đầu ra của CTĐT (bao gồm cả chuẩn đầu ra Ngoại ngữ không chuyên và Tin học không chuyên), điểm trung bình tích lũy toàn khóa đạt từ trung bình trở lên (≥ 2,00 theo thang điểm 4), và không bị truy cứu trách nhiệm hình sự hoặc đang bị kỷ luật ở mức đình chỉ học tập.  Sinh viên không đi học hoặc không dự thi sẽ bị điểm F và vẫn phải đóng học phí."
nội dung và chuẩn đầu ra của ctdt áp dụng chung đối với hệ đào tạo đại học chính quy là gì,"Không có thông tin. Tài liệu đề cập đến tiêu chí đánh giá ""Hội nhập tốt"" trong danh hiệu Sinh viên 5 tốt,  và các ngành đào tạo tại phân hiệu Ninh Thuận, nhưng không cung cấp thông tin về nội dung và chuẩn đầu ra của CTĐT áp dụng chung đối với hệ đào tạo đại học chính quy."
nội dung và chuẩn đầu ra của ctdt áp dụng chung đối với hệ đào tạo đại học là gì,"Không có thông tin. Tài liệu cung cấp thông tin về quy định bảo lưu và chuyển điểm học phần, và các ngành đào tạo tại phân hiệu Ninh Thuận, nhưng không đề cập đến nội dung và chuẩn đầu ra của chương trình đào tạo đại học."
nội dung và chuẩn đầu ra của ctdt áp dụng chung đối với hệ đào tạo đại học nào,"Không có thông tin.  Tài liệu đã cung cấp chỉ đề cập đến quy định về bảo lưu và chuyển điểm học phần, cũng như danh sách các ngành đào tạo tại phân hiệu Ninh Thuận.  Nội dung và chuẩn đầu ra của chương trình đào tạo đại học không được đề cập đến trong các tài liệu này."
